{
  "schema_version": 1,
  "run_id": "github-radar-2026-09-09-110145",
  "date": "2026-09-09",
  "generated_at": "2026-09-09T11:04:22+08:00",
  "window": {"start":"2026-08-10","end":"2026-09-09"},
  "summary": "本期在北京时间11:01至11:04以 GitHub Search、仓库 API、默认分支 Commit、Release 和 License 端点建立并复核候选池。agent-reach 的本机入口仍因解释器缺失不可运行，故实际检索使用其 GitHub/gh 路由规定的 gh CLI；没有使用模型记忆补全事实。最终收录6个项目、5个领域，按3个明确势头、2个跨领域潜力、1个意外发现组织。相对9月8日均为新进入视野；没有可复核的同repo 7日或30日快照，增长数均为null；未执行候选代码或安装依赖。",
  "trends":["能源转型的开源基础设施同时需要电力系统模型与可追溯的真实数据解析。","参与式民主软件和免费课程都把公共能力沉淀为可维护的数字基础设施。","个人财务与游戏收藏的聚合工具提醒我们：第三方连接、隐私和许可是体验的一部分。"],
  "projects":[
    {"repo_id":"49414256","full_name":"PyPSA/PyPSA","url":"https://github.com/PyPSA/PyPSA","domain":"气候、能源与地球","tags":["power-systems","energy-modeling","python"],"category":"established_momentum","change_type":"new","summary":"项目方声明：PyPSA 是用于电力系统分析的 Python 工具。","why_now":"主分支最新提交为2026-09-08，最新发布为2026-08-19，本次快照为2132 Stars。","what_it_signals":"推断：能源转型讨论需要可复核的系统级建模工具，而不只是单点设备叙事。","metrics":{"stars":2132,"forks":692,"contributors":null,"latest_commit_at":"2026-09-08T14:43:24Z","latest_release_at":"2026-08-19T13:12:52Z","license":"MIT"},"momentum":{"stars_7d":null,"stars_30d":null,"proxy_signals":["2026-09-08主线提交","窗口内发布"]},"stage":"stable_development","risks":["模型结论取决于输入数据、情景和假设，不能直接解释为政策或投资建议。","未运行模型或验证输出。"],"confidence":"high","recommended_action":"阅读其情景与数据假设说明，不将示例结果用于现实决策。","evidence":[{"type":"repository","url":"https://github.com/PyPSA/PyPSA","observed_at":"2026-09-09T11:04:22+08:00"},{"type":"readme","url":"https://github.com/PyPSA/PyPSA/blob/master/README.md","observed_at":"2026-09-09T11:04:22+08:00"},{"type":"recent_activity","url":"https://api.github.com/repos/PyPSA/PyPSA/commits?per_page=1","observed_at":"2026-09-09T11:04:22+08:00"},{"type":"release","url":"https://api.github.com/repos/PyPSA/PyPSA/releases/latest","observed_at":"2026-09-09T11:04:22+08:00"},{"type":"license","url":"https://api.github.com/repos/PyPSA/PyPSA/license","observed_at":"2026-09-09T11:04:22+08:00"}]},
    {"repo_id":"59370571","full_name":"electricitymaps/electricitymaps-contrib","url":"https://github.com/electricitymaps/electricitymaps-contrib","domain":"气候、能源与地球","tags":["electricity-data","carbon-intensity","data-parsers"],"category":"overlooked_cross_domain","change_type":"new","summary":"项目方声明：这是为 Electricity Maps 平台提供电力数据解析器的开源仓库。","why_now":"主分支最新提交为2026-09-07，本次快照为4032 Stars。","what_it_signals":"推断：碳强度等公共指标的可信度依赖可审查的数据接入与解析维护。","metrics":{"stars":4032,"forks":1059,"contributors":null,"latest_commit_at":"2026-09-07T12:36:12Z","latest_release_at":"2026-04-28T12:41:28Z","license":"AGPL-3.0"},"momentum":{"stars_7d":null,"stars_30d":null,"proxy_signals":["2026-09-07主线提交","数据解析基础设施"]},"stage":"stable_development","risks":["地区数据的覆盖、时间滞后和计算方法须逐项核验。","AGPL-3.0的网络服务义务需单独审查。"],"confidence":"high","recommended_action":"阅读一个地区解析器及其来源，不据单一指标做能源判断。","evidence":[{"type":"repository","url":"https://github.com/electricitymaps/electricitymaps-contrib","observed_at":"2026-09-09T11:04:22+08:00"},{"type":"readme","url":"https://github.com/electricitymaps/electricitymaps-contrib/blob/master/README.md","observed_at":"2026-09-09T11:04:22+08:00"},{"type":"recent_activity","url":"https://api.github.com/repos/electricitymaps/electricitymaps-contrib/commits?per_page=1","observed_at":"2026-09-09T11:04:22+08:00"},{"type":"release","url":"https://api.github.com/repos/electricitymaps/electricitymaps-contrib/releases/latest","observed_at":"2026-09-09T11:04:22+08:00"},{"type":"license","url":"https://api.github.com/repos/electricitymaps/electricitymaps-contrib/license","observed_at":"2026-09-09T11:04:22+08:00"}]},
    {"repo_id":"39152554","full_name":"consuldemocracy/consuldemocracy","url":"https://github.com/consuldemocracy/consuldemocracy","domain":"社会、公共事务与公益","tags":["civic-tech","participation","open-government"],"category":"established_momentum","change_type":"new","summary":"项目方声明：Consul Democracy 是开源的电子参与和开放政府软件。","why_now":"主分支最新提交为2026-09-07，最新发布为2026-09-02，本次快照为1548 Stars。","what_it_signals":"推断：参与式公共服务需要持续的软件维护与治理，而非一次性的在线投票界面。","metrics":{"stars":1548,"forks":1121,"contributors":null,"latest_commit_at":"2026-09-07T14:57:26Z","latest_release_at":"2026-09-02T15:03:59Z","license":"AGPL-3.0"},"momentum":{"stars_7d":null,"stars_30d":null,"proxy_signals":["窗口内发布","2026-09-07主线提交"]},"stage":"stable_development","risks":["参与结果、身份验证和制度合法性依赖具体部署方。","AGPL-3.0与公共数据保护义务须单独审查。"],"confidence":"high","recommended_action":"阅读实施案例与治理边界，不根据项目宣传形成公共政策判断。","evidence":[{"type":"repository","url":"https://github.com/consuldemocracy/consuldemocracy","observed_at":"2026-09-09T11:04:22+08:00"},{"type":"readme","url":"https://github.com/consuldemocracy/consuldemocracy/blob/master/README.md","observed_at":"2026-09-09T11:04:22+08:00"},{"type":"recent_activity","url":"https://api.github.com/repos/consuldemocracy/consuldemocracy/commits?per_page=1","observed_at":"2026-09-09T11:04:22+08:00"},{"type":"release","url":"https://api.github.com/repos/consuldemocracy/consuldemocracy/releases/latest","observed_at":"2026-09-09T11:04:22+08:00"},{"type":"license","url":"https://api.github.com/repos/consuldemocracy/consuldemocracy/license","observed_at":"2026-09-09T11:04:22+08:00"}]},
    {"repo_id":"28457823","full_name":"freeCodeCamp/freeCodeCamp","url":"https://github.com/freeCodeCamp/freeCodeCamp","domain":"教育与知识传播","tags":["open-education","curriculum","computer-science"],"category":"established_momentum","change_type":"new","summary":"项目方声明：这是免费学习数学、编程和计算机科学的开源课程与代码库。","why_now":"主分支最新提交为2026-09-08，本次快照为455239 Stars。","what_it_signals":"推断：大规模开放课程的价值来自内容、练习和社区维护的长期协同。","metrics":{"stars":455239,"forks":46150,"contributors":null,"latest_commit_at":"2026-09-08T17:08:25Z","latest_release_at":null,"license":"BSD-3-Clause"},"momentum":{"stars_7d":null,"stars_30d":null,"proxy_signals":["2026-09-08主线提交","大规模学习社区"]},"stage":"stable_development","risks":["课程的适用性和时效性需按具体路径验证。","最新Release不可得，不将仓库活跃度等同于任意课程更新。"],"confidence":"high","recommended_action":"阅读一条课程路径的版本记录与教学设计。","evidence":[{"type":"repository","url":"https://github.com/freeCodeCamp/freeCodeCamp","observed_at":"2026-09-09T11:04:22+08:00"},{"type":"readme","url":"https://github.com/freeCodeCamp/freeCodeCamp/blob/main/README.md","observed_at":"2026-09-09T11:04:22+08:00"},{"type":"recent_activity","url":"https://api.github.com/repos/freeCodeCamp/freeCodeCamp/commits?per_page=1","observed_at":"2026-09-09T11:04:22+08:00"},{"type":"release_status","url":"https://api.github.com/repos/freeCodeCamp/freeCodeCamp/releases","observed_at":"2026-09-09T11:04:22+08:00"},{"type":"license","url":"https://api.github.com/repos/freeCodeCamp/freeCodeCamp/license","observed_at":"2026-09-09T11:04:22+08:00"}]},
    {"repo_id":"21298446","full_name":"firefly-iii/firefly-iii","url":"https://github.com/firefly-iii/firefly-iii","domain":"商业、经济与金融","tags":["personal-finance","self-hosted","privacy"],"category":"overlooked_cross_domain","change_type":"new","summary":"项目方声明：Firefly III 是个人财务管理工具。","why_now":"主分支最新提交为2026-09-08，本次快照为24551 Stars。","what_it_signals":"推断：个人财务工具的开放性可提高可迁移性，但不会消除数据质量与安全责任。","metrics":{"stars":24551,"forks":2278,"contributors":null,"latest_commit_at":"2026-09-08T02:43:05Z","latest_release_at":"2026-07-01T19:09:14Z","license":"AGPL-3.0"},"momentum":{"stars_7d":null,"stars_30d":null,"proxy_signals":["2026-09-08主线提交","较高社区规模"]},"stage":"stable_development","risks":["不构成投资或税务建议。","财务账户数据、第三方连接与自托管安全须单独核验。"],"confidence":"high","recommended_action":"仅阅读数据导入与备份设计，不导入真实账户。","evidence":[{"type":"repository","url":"https://github.com/firefly-iii/firefly-iii","observed_at":"2026-09-09T11:04:22+08:00"},{"type":"readme","url":"https://github.com/firefly-iii/firefly-iii/blob/main/README.md","observed_at":"2026-09-09T11:04:22+08:00"},{"type":"recent_activity","url":"https://api.github.com/repos/firefly-iii/firefly-iii/commits?per_page=1","observed_at":"2026-09-09T11:04:22+08:00"},{"type":"release","url":"https://api.github.com/repos/firefly-iii/firefly-iii/releases/latest","observed_at":"2026-09-09T11:04:22+08:00"},{"type":"license","url":"https://api.github.com/repos/firefly-iii/firefly-iii/license","observed_at":"2026-09-09T11:04:22+08:00"}]},
    {"repo_id":"86182490","full_name":"JosefNemec/Playnite","url":"https://github.com/JosefNemec/Playnite","domain":"游戏与互动体验","tags":["game-library","emulation","desktop"],"category":"surprising_and_experimental","change_type":"new","summary":"项目方声明：Playnite 把第三方游戏库与模拟器整合到统一界面。","why_now":"本次快照为13916 Stars；虽然最新主线提交为2026-08-31且发布为2026-05-26，2026-09-08仓库仍有更新信号，故作为低置信度的观察项而非势头结论。","what_it_signals":"推断：个人数字游戏收藏的组织仍依赖跨平台元数据与服务边界。","metrics":{"stars":13916,"forks":680,"contributors":null,"latest_commit_at":"2026-08-31T10:53:47Z","latest_release_at":"2026-05-26T13:20:01Z","license":"MIT"},"momentum":{"stars_7d":null,"stars_30d":null,"proxy_signals":["2026-09-08仓库更新信号","跨服务游戏库聚合"]},"stage":"stable_development","risks":["第三方账户、模拟器和游戏内容许可须分别核验。","近期代码活动有限，不能据此推断功能或兼容性改善。"],"confidence":"medium","recommended_action":"纯粹有趣：阅读支持服务清单与隐私说明，不连接真实账户。","evidence":[{"type":"repository","url":"https://github.com/JosefNemec/Playnite","observed_at":"2026-09-09T11:04:22+08:00"},{"type":"readme","url":"https://github.com/JosefNemec/Playnite/blob/master/README.md","observed_at":"2026-09-09T11:04:22+08:00"},{"type":"recent_activity","url":"https://api.github.com/repos/JosefNemec/Playnite/commits?per_page=1","observed_at":"2026-09-09T11:04:22+08:00"},{"type":"release","url":"https://api.github.com/repos/JosefNemec/Playnite/releases/latest","observed_at":"2026-09-09T11:04:22+08:00"},{"type":"license","url":"https://api.github.com/repos/JosefNemec/Playnite/license","observed_at":"2026-09-09T11:04:22+08:00"}]}
  ]
}
