{"schema_version":1,"run_id":"github-radar-2026-09-11-110123","date":"2026-09-11","generated_at":"2026-09-11T11:03:00+08:00","window":{"start":"2026-08-12","end":"2026-09-11"},"summary":"本期使用 GitHub Search 和仓库 API 复核。agent-reach 本机解释器缺失，故按其 GitHub/gh 路由使用 gh CLI。收录6个项目、6个领域；精确提交、发布或增长端点不可得均为null，未执行候选代码。","trends":["公共知识与本地媒体服务仍在持续维护。","气候模型和驾驶辅助的影响取决于真实边界与安全约束。","开放设计工具正在覆盖教育、公共服务和互动体验。"],"projects":[
{"repo_id":"5616877","full_name":"Revolutionary-Games/Thrive","url":"https://github.com/Revolutionary-Games/Thrive","domain":"科学研究","tags":["evolution","simulation"],"category":"surprising_and_experimental","change_type":"new","summary":"项目方声明：Thrive 是进化主题模拟游戏。","why_now":"GitHub Search 显示仓库于2026-09-10有活动，本次快照3691 Stars。","what_it_signals":"推断：互动模拟可成为理解复杂生命系统的入口。","metrics":{"stars":3691,"forks":622,"contributors":null,"latest_commit_at":null,"latest_release_at":null,"license":"NOASSERTION"},"momentum":{"stars_7d":null,"stars_30d":null,"proxy_signals":["近期仓库活动"]},"stage":"stable_development","risks":["模拟不等于科学模型；许可证需独立核对。"],"confidence":"medium","recommended_action":"阅读模型说明，不把游戏输出当科研结论。","evidence":[{"type":"repository","url":"https://github.com/Revolutionary-Games/Thrive","observed_at":"2026-09-11T11:03:00+08:00"},{"type":"recent_activity","url":"https://api.github.com/repos/Revolutionary-Games/Thrive/commits?per_page=1","observed_at":"2026-09-11T11:03:00+08:00"},{"type":"license","url":"https://api.github.com/repos/Revolutionary-Games/Thrive/license","observed_at":"2026-09-11T11:03:00+08:00"}]},
{"repo_id":"152878952","full_name":"CliMA/Oceananigans.jl","url":"https://github.com/CliMA/Oceananigans.jl","domain":"气候、能源与地球","tags":["ocean","climate-model"],"category":"established_momentum","change_type":"major_progress","summary":"项目方声明：这是海洋模拟工具。","why_now":"相对历史记录，GitHub Search 显示2026-09-11仍有活动。","what_it_signals":"推断：地球系统模型需由持续维护支撑可复核性。","metrics":{"stars":1412,"forks":295,"contributors":null,"latest_commit_at":null,"latest_release_at":null,"license":"MIT"},"momentum":{"stars_7d":null,"stars_30d":null,"proxy_signals":["历史项目的新活动"]},"stage":"stable_development","risks":["未运行模型或验证输出。"],"confidence":"medium","recommended_action":"持续跟踪变更说明。","evidence":[{"type":"repository","url":"https://github.com/CliMA/Oceananigans.jl","observed_at":"2026-09-11T11:03:00+08:00"},{"type":"recent_activity","url":"https://api.github.com/repos/CliMA/Oceananigans.jl/commits?per_page=1","observed_at":"2026-09-11T11:03:00+08:00"},{"type":"license","url":"https://api.github.com/repos/CliMA/Oceananigans.jl/license","observed_at":"2026-09-11T11:03:00+08:00"}]},
{"repo_id":"13491895","full_name":"EbookFoundation/free-programming-books","url":"https://github.com/EbookFoundation/free-programming-books","domain":"教育与知识传播","tags":["open-education","books"],"category":"established_momentum","change_type":"new","summary":"项目方声明：这是免费编程书籍清单。","why_now":"GitHub Search 显示2026-09-10活动，本次快照396466 Stars。","what_it_signals":"推断：开放学习资源的发现与维护本身就是教育基础设施。","metrics":{"stars":396466,"forks":66752,"contributors":null,"latest_commit_at":null,"latest_release_at":null,"license":"CC-BY-4.0"},"momentum":{"stars_7d":null,"stars_30d":null,"proxy_signals":["近期仓库活动"]},"stage":"stable_development","risks":["外链内容的时效性和许可须逐项核验。"],"confidence":"high","recommended_action":"阅读一个主题清单并核验原始许可。","evidence":[{"type":"repository","url":"https://github.com/EbookFoundation/free-programming-books","observed_at":"2026-09-11T11:03:00+08:00"},{"type":"recent_activity","url":"https://api.github.com/repos/EbookFoundation/free-programming-books/commits?per_page=1","observed_at":"2026-09-11T11:03:00+08:00"},{"type":"license","url":"https://api.github.com/repos/EbookFoundation/free-programming-books/license","observed_at":"2026-09-11T11:03:00+08:00"}]},
{"repo_id":"741012134","full_name":"suitenumerique/docs","url":"https://github.com/suitenumerique/docs","domain":"社会、公共事务与公益","tags":["documents","public-digital-services"],"category":"overlooked_cross_domain","change_type":"new","summary":"项目方声明：这是协作文档服务。","why_now":"GitHub Search 显示2026-09-10活动，本次快照16811 Stars。","what_it_signals":"推断：公共数字服务可通过开放协作工具积累能力。","metrics":{"stars":16811,"forks":628,"contributors":null,"latest_commit_at":null,"latest_release_at":null,"license":"MIT"},"momentum":{"stars_7d":null,"stars_30d":null,"proxy_signals":["近期仓库活动"]},"stage":"rapid_growth","risks":["文档权限、数据驻留和部署治理须单独审核。"],"confidence":"medium","recommended_action":"阅读部署与权限文档，不处理真实文件。","evidence":[{"type":"repository","url":"https://github.com/suitenumerique/docs","observed_at":"2026-09-11T11:03:00+08:00"},{"type":"recent_activity","url":"https://api.github.com/repos/suitenumerique/docs/commits?per_page=1","observed_at":"2026-09-11T11:03:00+08:00"},{"type":"license","url":"https://api.github.com/repos/suitenumerique/docs/license","observed_at":"2026-09-11T11:03:00+08:00"}]},
{"repo_id":"52481933","full_name":"navidrome/navidrome","url":"https://github.com/navidrome/navidrome","domain":"艺术、设计与媒体","tags":["music","self-hosted"],"category":"established_momentum","change_type":"major_progress","summary":"项目方声明：这是个人音乐流媒体服务。","why_now":"相对9月8日记录，GitHub Search 显示2026-09-11继续活动。","what_it_signals":"推断：本地媒体服务持续为数字收藏提供替代平台路径。","metrics":{"stars":23446,"forks":1693,"contributors":null,"latest_commit_at":null,"latest_release_at":null,"license":"GPL-3.0"},"momentum":{"stars_7d":null,"stars_30d":null,"proxy_signals":["历史项目的新活动"]},"stage":"stable_development","risks":["音乐版权与网络访问控制须单独处理。"],"confidence":"medium","recommended_action":"阅读发布与权限说明。","evidence":[{"type":"repository","url":"https://github.com/navidrome/navidrome","observed_at":"2026-09-11T11:03:00+08:00"},{"type":"recent_activity","url":"https://api.github.com/repos/navidrome/navidrome/commits?per_page=1","observed_at":"2026-09-11T11:03:00+08:00"},{"type":"license","url":"https://api.github.com/repos/navidrome/navidrome/license","observed_at":"2026-09-11T11:03:00+08:00"}]},
{"repo_id":"74627617","full_name":"commaai/openpilot","url":"https://github.com/commaai/openpilot","domain":"硬件、机器人与 Maker","tags":["driver-assistance","robotics"],"category":"surprising_and_experimental","change_type":"major_progress","summary":"项目方声明：openpilot 可升级部分车辆驾驶辅助。","why_now":"相对9月8日记录，GitHub Search 显示2026-09-11继续活动。","what_it_signals":"推断：开放驾驶辅助的可信度取决于安全边界和真实车辆支持。","metrics":{"stars":63627,"forks":11360,"contributors":null,"latest_commit_at":null,"latest_release_at":null,"license":"MIT"},"momentum":{"stars_7d":null,"stars_30d":null,"proxy_signals":["历史项目的新活动"]},"stage":"stable_development","risks":["驾驶辅助不是自动驾驶；安全、法律与车辆限制优先。"],"confidence":"medium","recommended_action":"仅阅读安全说明，不连接车辆。","evidence":[{"type":"repository","url":"https://github.com/commaai/openpilot","observed_at":"2026-09-11T11:03:00+08:00"},{"type":"recent_activity","url":"https://api.github.com/repos/commaai/openpilot/commits?per_page=1","observed_at":"2026-09-11T11:03:00+08:00"},{"type":"license","url":"https://api.github.com/repos/commaai/openpilot/license","observed_at":"2026-09-11T11:03:00+08:00"}]}
]}
